{
  "parentJobId": "10000000-0000-4000-8000-000000000001",
  "parentAttemptId": "10000000-0000-4000-8000-000000000002",
  "tenantId": "10000000-0000-4000-8000-000000000003",
  "siteId": "10000000-0000-4000-8000-000000000004",
  "crawlId": "10000000-0000-4000-8000-000000000005",
  "bundleId": "10000000-0000-4000-8000-000000000006",
  "targetId": "10000000-0000-4000-8000-000000000007",
  "bootstrapInvocationId": "10000000-0000-4000-8000-000000000008",
  "scopeObservationId": "10000000-0000-4000-8000-000000000009",
  "scopeEvidenceId": "10000000-0000-4000-8000-000000000010",
  "robotsObservationId": "10000000-0000-4000-8000-000000000011",
  "robotsReceiptEvidenceId": "10000000-0000-4000-8000-000000000012",
  "scopeSha256": "aaaaaaaaaaaaaaaaaaaaaaaaaaaaaaaaaaaaaaaaaaaaaaaaaaaaaaaaaaaaaaaa",
  "robotsContextHash": "aaaaaaaaaaaaaaaaaaaaaaaaaaaaaaaaaaaaaaaaaaaaaaaaaaaaaaaaaaaaaaaa",
  "sourceContextHash": "aaaaaaaaaaaaaaaaaaaaaaaaaaaaaaaaaaaaaaaaaaaaaaaaaaaaaaaaaaaaaaaa",
  "parentAttempt": 1,
  "knownSeq": 1,
  "targetVersion": 1,
  "version": 1,
  "handler": "http_seed_fixture_v1",
  "profile": "isolated-http-seed-fixture-v1",
  "policy": "discovery-v1",
  "method": "GET",
  "maxDecodedBytes": 5242880,
  "timeoutMs": 20000,
  "robotsBodyEvidenceId": null,
  "origin": "https://receipt.example",
  "url": "https://receipt.example/services"
}
